id	title	description	google product category	product type	link	image_link	additional_image_link	additional_image_link	additional_image_link	additional_image_link	condition	availability	price	sale price	sale price effective date	gtin	brand	mpn	item group id	multipack	color	size	shipping	shipping weight
10XLP/ABK	Extra large print Bible (hardback)	Extra Large print Bible without references for comfortable reading. Durable vinyl covered hardback binding. Authorised (King James) Version.	Media > Books	English Bibles	https://www.tbsbibles.org/store/ListProducts.aspx?ftr=10XLP/ABK	https://raw.githubusercontent.com/tbs-master/tbs-public-product-data/latest/images/10XLP_ABK-a.jpg	https://raw.githubusercontent.com/tbs-master/tbs-public-product-data/latest/images/10XLP_ABK-b.jpg	https://raw.githubusercontent.com/tbs-master/tbs-public-product-data/latest/images/10XLP_ABK-c.jpg	https://raw.githubusercontent.com/tbs-master/tbs-public-product-data/latest/images/10XLP_ABK-d.jpg	https://raw.githubusercontent.com/tbs-master/tbs-public-product-data/latest/images/10XLP_ABK-e.jpg	new	in stock	22.5 GBP			9781862285354	Trinitarian Bible Society	10XLP/ABK		1	Black			1800 g
120LP/ABK	Large Print Westminster Reference Bible (hardback)	Large Print Westminster Reference Bible vinyl covered hardback. This Bible contains over two hundred thousand cross references, and also features 8 full-colour maps.	Media > Books	English Bibles	https://www.tbsbibles.org/store/ListProducts.aspx?ftr=120LP/ABK	https://raw.githubusercontent.com/tbs-master/tbs-public-product-data/latest/images/120LP_ABK-a.jpg	https://raw.githubusercontent.com/tbs-master/tbs-public-product-data/latest/images/120LP_ABK-b.jpg	https://raw.githubusercontent.com/tbs-master/tbs-public-product-data/latest/images/120LP_ABK-c.jpg	https://raw.githubusercontent.com/tbs-master/tbs-public-product-data/latest/images/120LP_ABK-d.jpg	https://raw.githubusercontent.com/tbs-master/tbs-public-product-data/latest/images/120LP_ABK-e.jpg	new	in stock	25 GBP			9781862284746	Trinitarian Bible Society	120LP/ABK		1	Black			1620 g
120LP/UBK	Large Print Westminster Reference Bible (calfskin)	Large Print Westminster Reference Bible in calfskin leather. This Bible contains over two hundred thousand cross references, and also features 8 full-colour maps.	Media > Books	English Bibles	https://www.tbsbibles.org/store/ListProducts.aspx?ftr=120LP/UBK	https://raw.githubusercontent.com/tbs-master/tbs-public-product-data/latest/images/120LP_UBK-a.jpg	https://raw.githubusercontent.com/tbs-master/tbs-public-product-data/latest/images/120LP_UBK-b.jpg	https://raw.githubusercontent.com/tbs-master/tbs-public-product-data/latest/images/120LP_UBK-c.jpg	https://raw.githubusercontent.com/tbs-master/tbs-public-product-data/latest/images/120LP_UBK-d.jpg	https://raw.githubusercontent.com/tbs-master/tbs-public-product-data/latest/images/120LP_UBK-e.jpg	new	in stock	85 GBP			9781862284753	Trinitarian Bible Society	120LP/UBK		1	Black			1800 g
25/ABK	Windsor Text Bible (hardback)	Medium print Bible without references in vinyl covered hardback. Distinctive clear text with good line spacing for optimum clarity and readability and also features 8 full-colour maps. [Was 25A/BK]	Media > Books	English Bibles	https://www.tbsbibles.org/store/ListProducts.aspx?ftr=25/ABK	https://raw.githubusercontent.com/tbs-master/tbs-public-product-data/latest/images/25_ABK-a.jpg	https://raw.githubusercontent.com/tbs-master/tbs-public-product-data/latest/images/25_ABK-b.jpg	https://raw.githubusercontent.com/tbs-master/tbs-public-product-data/latest/images/25_ABK-c.jpg	https://raw.githubusercontent.com/tbs-master/tbs-public-product-data/latest/images/25_ABK-d.jpg	https://raw.githubusercontent.com/tbs-master/tbs-public-product-data/latest/images/25_ABK-e.jpg	new	in stock	12.75 GBP			9781862283305	Trinitarian Bible Society	25/ABK		1	Black			690 g
25/ABL	Windsor Text Bible (hardback)	Medium print Bible without references in vinyl covered hardback. Distinctive clear text with good line spacing for optimum clarity and readability and also features 8 full-colour maps. [Was 25A/BL]	Media > Books	English Bibles	https://www.tbsbibles.org/store/ListProducts.aspx?ftr=25/ABL	https://raw.githubusercontent.com/tbs-master/tbs-public-product-data/latest/images/25_ABL-a.jpg	https://raw.githubusercontent.com/tbs-master/tbs-public-product-data/latest/images/25_ABL-b.jpg	https://raw.githubusercontent.com/tbs-master/tbs-public-product-data/latest/images/25_ABL-c.jpg	https://raw.githubusercontent.com/tbs-master/tbs-public-product-data/latest/images/25_ABL-d.jpg	https://raw.githubusercontent.com/tbs-master/tbs-public-product-data/latest/images/25_ABL-e.jpg	new	in stock	12.75 GBP			9781862283312	Trinitarian Bible Society	25/ABL		1	Blue			690 g